#
# Issue #64: WITH CONSISTENT SNAPSHOT doesn't work
#
CREATE TABLE t_snap64 (
a INT,
b INT
) ENGINE=TidesDB;
# Seed some data so global_seq > 0
INSERT INTO t_snap64 VALUES (100, 100);
DELETE FROM t_snap64 WHERE a = 100;
# ---- TEST 1: START TRANSACTION WITH CONSISTENT SNAPSHOT ----
SET TRANSACTION ISOLATION LEVEL REPEATABLE READ;
START TRANSACTION WITH CONSISTENT SNAPSHOT;
# Insert from connection 2 AFTER snapshot
INSERT INTO t_snap64 (a, b) VALUES (1, 10);
SELECT * FROM t_snap64 ORDER BY a;
a	b
1	10
# Connection 1 should NOT see the row (snapshot was before insert)
SELECT * FROM t_snap64 ORDER BY a;
a	b
COMMIT;
# After COMMIT, a new snapshot should see the row
SELECT * FROM t_snap64 ORDER BY a;
a	b
1	10
# ---- TEST 2: Multiple inserts after snapshot ----
SET TRANSACTION ISOLATION LEVEL REPEATABLE READ;
START TRANSACTION WITH CONSISTENT SNAPSHOT;
INSERT INTO t_snap64 (a, b) VALUES (2, 20);
INSERT INTO t_snap64 (a, b) VALUES (3, 30);
# Should still only see row (1,10) from before the snapshot
SELECT * FROM t_snap64 ORDER BY a;
a	b
1	10
COMMIT;
# After COMMIT, should see all 3 rows
SELECT * FROM t_snap64 ORDER BY a;
a	b
1	10
2	20
3	30
# ---- TEST 3: Without CONSISTENT SNAPSHOT, new data IS visible ----
BEGIN;
INSERT INTO t_snap64 (a, b) VALUES (4, 40);
# Without CONSISTENT SNAPSHOT, should see all 4 rows
SELECT * FROM t_snap64 ORDER BY a;
a	b
1	10
2	20
3	30
4	40
COMMIT;
# ---- TEST 4: the snapshot survives compaction of the versions it reads ----
SET TRANSACTION ISOLATION LEVEL REPEATABLE READ;
START TRANSACTION WITH CONSISTENT SNAPSHOT;
# reader sees the four rows written so far
SELECT COUNT(*) AS rows_at_snapshot FROM t_snap64;
rows_at_snapshot
4
DELETE FROM t_snap64;
INSERT INTO t_snap64 (a, b) VALUES (90, 900), (91, 910), (92, 920);
# still the snapshot's four rows, not the writer's three
SELECT COUNT(*) AS rows_after_writer FROM t_snap64;
rows_after_writer
4
SELECT * FROM t_snap64 ORDER BY a;
a	b
1	10
2	20
3	30
4	40
COMMIT;
# after COMMIT the writer's rows are what is there
SELECT * FROM t_snap64 ORDER BY a;
a	b
90	900
91	910
92	920
# Cleanup
DROP TABLE t_snap64;
#
# Done.
